{
  "schema_version": "1.0",
  "type": "import",
  "id": "helixforge.rnaseq.example.import",
  "status": "complete",
  "dataset": "example",
  "reference_sha256": "example-reference-sha256",
  "artifacts": {
    "counts": {
      "path": "tables/counts_matrix.tsv",
      "format": "tsv",
      "sha256": "example-counts-sha256",
      "available": true
    },
    "abundance": {
      "path": "tables/tpm_matrix.tsv",
      "format": "tsv",
      "sha256": "example-abundance-sha256",
      "available": true
    }
  }
}
